{
  "schema": "didcomm-fixture/v1",
  "id": "spec-c3-anon-x25519-xc20p-1",
  "description": "DIDComm v2.1 Appendix C.3: Anoncrypt to Bob over X25519 with XC20P content encryption (vector 1).",
  "source": "spec-v2.1",
  "source_ref": "Appendix C.3 anoncrypt example 1",
  "direction": "inbound",
  "operation": "unpack",
  "tags": ["anoncrypt", "ECDH-ES+A256KW", "X25519", "XC20P", "multi-recipient"],
  "input": {
    "packed": "packed/spec/test-encrypted-didcomm-message-anon-xc20p-1.json"
  },
  "expected": {
    "outcome": "success",
    "plaintext": "payloads/c1-lets-do-lunch.json",
    "metadata": {
      "encrypted": true,
      "authenticated": false,
      "non_repudiation": false,
      "anonymous_sender": true,
      "enc": "XC20P",
      "kw": "ECDH-ES+A256KW"
    },
    "match": "roundtrip"
  }
}
